{"$schema":"https://json-schema.org/draft/2020-12/schema","$id":"https://rehostrace.example/schemas/harness_plan.schema.json","title":"RehostRace hash-pinned harness plan","type":"object","required":["schema_version","plan_id","kind","transport","identity","stages"],"properties":{"schema_version":{"const":"rehostrace.harness-plan/v1"},"plan_id":{"type":"string"},"kind":{"enum":["android-native-stack","controller-firmware"]},"transport":{"type":"string"},"identity":{"type":"object"},"inputs":{"type":"array","items":{"type":"string"}},"outputs":{"type":"array","items":{"type":"string"}},"stages":{"type":"array","minItems":1,"items":{"type":"object"}}},"additionalProperties":false}
