{
  "schema_version": "rehostrace.harness-plan/v1",
  "plan_id": "public.android-native-stack.v1",
  "kind": "android-native-stack",
  "transport": "binder-proxy",
  "identity": {"target_sha256": "4444444444444444444444444444444444444444444444444444444444444444", "runner_sha256": "5555555555555555555555555555555555555555555555555555555555555555"},
  "inputs": ["causal-trace", "protocol-pack"],
  "outputs": ["coverage-map", "boundary-trace", "sanitizer-log"],
  "stages": [
    {"id": "clean-state", "action": "reset", "timeout_ms": 5000},
    {"id": "load-stack", "action": "load", "timeout_ms": 30000},
    {"id": "inject-boundary", "action": "feed", "timeout_ms": 30000},
    {"id": "observe-runtime", "action": "observe", "timeout_ms": 30000},
    {"id": "collect-evidence", "action": "collect", "timeout_ms": 10000}
  ]
}
